{
  "theme_id": "creative-bold",
  "theme_name": "Creative Bold",
  "version": "3.0.0",
  "description": "Vibrant and energetic with bold colors and playful typography. Perfect for creatives and influencers.",
  "style": {
    "variant": "bold",
    "label": "Bold & Creative",
    "mood": "energetic"
  },
  "metadata": {
    "tags": ["bold", "creative", "colorful", "energetic", "playful"],
    "preview_colors": ["#ec4899", "#8b5cf6", "#06b6d4"],
    "is_premium": false,
    "is_dark": false,
    "sort_order": 40,
    "author": "Guestify"
  },
  "preview_image": "preview.jpg",
  "thumbnail_image": "thumbnail.jpg",
  "typography": {
    "primary_font": {
      "family": "DM Sans, sans-serif",
      "weights": [400, 500, 700],
      "fallback": "-apple-system, BlinkMacSystemFont, sans-serif"
    },
    "heading_font": {
      "family": "Space Grotesk, sans-serif",
      "weights": [500, 600, 700],
      "fallback": "Arial Black, sans-serif"
    },
    "font_scale": 1.25,
    "line_height": {
      "body": 1.7,
      "heading": 1.1
    },
    "letter_spacing": {
      "body": "0",
      "heading": "-0.03em"
    }
  },
  "colors": {
    "primary": "#ec4899",
    "primary_hover": "#db2777",
    "secondary": "#8b5cf6",
    "secondary_hover": "#7c3aed",
    "accent": "#06b6d4",
    "accent_hover": "#0891b2",
    "text": "#1e1b4b",
    "text_light": "#4c4a6d",
    "text_muted": "#7c7a9c",
    "background": "#ffffff",
    "surface": "#faf5ff",
    "surface_hover": "#f3e8ff",
    "border": "#e9d5ff",
    "border_focus": "#ec4899",
    "gradient_start": "#ec4899",
    "gradient_end": "#8b5cf6",
    "error": "#ef4444",
    "success": "#10b981",
    "warning": "#f59e0b",
    "info": "#06b6d4"
  },
  "spacing": {
    "base_unit": "8px",
    "component_gap": "56px",
    "section_gap": "96px",
    "container_padding": "24px",
    "content_max_width": "1200px"
  },
  "effects": {
    "border_radius": "20px",
    "border_radius_sm": "12px",
    "border_radius_lg": "28px",
    "border_radius_full": "9999px",
    "shadow": "0 10px 40px rgba(236, 72, 153, 0.2)",
    "shadow_sm": "0 4px 12px rgba(236, 72, 153, 0.1)",
    "shadow_lg": "0 20px 60px rgba(236, 72, 153, 0.25)",
    "transitions": "all 0.3s cubic-bezier(0.4, 0, 0.2, 1)",
    "transitions_slow": "all 0.4s ease",
    "blur": "blur(12px)",
    "gradient": "linear-gradient(135deg, #ec4899, #8b5cf6)"
  },
  "components": {
    "button": {
      "padding": "14px 32px",
      "font_weight": "700",
      "letter_spacing": "0",
      "text_transform": "none",
      "border_radius": "9999px"
    },
    "card": {
      "padding": "28px",
      "shadow": "0 4px 20px rgba(236, 72, 153, 0.15)",
      "border_radius": "20px"
    },
    "input": {
      "padding": "14px 20px",
      "border_width": "2px",
      "border_radius": "12px"
    }
  },
  "responsive": {
    "breakpoints": {
      "sm": "640px",
      "md": "768px",
      "lg": "1024px",
      "xl": "1280px"
    },
    "font_scale_mobile": 0.88,
    "spacing_scale_mobile": 0.75
  }
}
